,depending,necessary,appropriate,inappropriate,as needed,as applicable,otherwise reasonably,sometimes,from time to time,generally,mostly,widely,general,commonly,usually,normally,typically,largely,often,primarily,among other things,may,might,can,could,would,likely,possible,possibly,anyone,certain,everyone,numerous,some,most,few,much,many,various,including but not limited to,Category,BT Coeff,Amb_Terms,Amb_Phrase
0,0,0,0,0,0,0,0,0,0,0,0,0,0,0,0,0,0,0,0,0,0,1,0,0,0,0,0,0,0,0,0,0,0,0,0,0,0,0,0,0,M,2.865,['may'],"['This Privacy Policy (“Privacy Policy”) sets out how we collect, process, use and may disclose your data when you use our mobile application called ‘Moj’ (“App”).']"
1,0,0,0,0,0,0,0,0,0,0,0,0,0,0,0,0,0,0,0,0,0,0,0,0,0,0,0,0,0,1,0,0,0,0,0,0,0,0,0,0,N,2.71,['anyone'],['We will not use or share your information with anyone except as described in this Privacy Policy.\xa0']
2,0,0,1,0,0,0,0,0,0,0,0,0,0,0,0,0,0,0,0,0,0,1,0,0,0,0,0,0,0,0,1,0,0,0,0,0,0,0,0,0,CMN,2.125,"['may', 'appropriate', 'certain']",['We may collect an indicative age range which tells us that you are of the appropriate age to access our Platform and certain features of our Platform (collectively “Log-in Data”).Content']
3,0,0,0,0,0,0,0,0,0,0,0,0,0,0,0,0,0,0,0,0,0,2,0,0,0,0,0,0,0,0,0,0,0,0,0,0,0,0,0,0,M,2.865,"['may', 'may']","['Information we receive from other sources: . We may also be working closely with third parties (including, for example, business partners, sub-contractors in technical, analytics providers, search information providers) and may receive information about you from such sources.']"
4,0,0,0,0,0,0,0,0,0,0,0,0,0,0,0,0,0,0,0,0,0,1,0,0,0,0,0,0,0,0,0,0,0,0,0,0,0,0,0,0,M,2.865,['may'],['Such data may be shared internally and combined with the data collected on this Platform.(b)']
5,0,0,0,0,0,0,0,0,0,0,0,0,1,0,0,0,0,0,0,0,0,0,0,0,0,0,0,0,0,0,0,0,0,0,0,0,0,0,0,0,G,3.55,['general'],"['Log Data: ""Log Data""\xa0is information that we automatically collect when you use the Platform, whether through the use of cookies, web beacons, log files, scripts, including, but not limited to:\xa0· technical information, such as your mobile carrier-related information, configuration information made available by your web browser or other programs you use to access the Platform, your IP address and your device’s version and identification number;· information about what you have searched for and viewed while using the Platform, such as web search terms used, social media profiles visited, mini applications used, and details of other information and content accessed or requested by you while using the Platform;· general information about communications on the platform, such as the identity of a user that you have communicated with and the time, data and duration of your communications; and\xa0· metadata, which means information related to items you have made available through the Platform, such as the date, time or location that a shared photograph or video was taken or posted.(c)']"
6,0,0,0,0,0,0,0,0,0,0,0,0,0,0,0,0,0,0,0,0,0,1,0,0,1,0,0,0,0,0,1,0,0,0,0,0,0,0,0,0,MN,2.569,"['may', 'certain', 'could']","['For detailed information on the cookies we use and the purposes for which we use them, kindly see our cookie policy (d) Surveys: If you choose to participate in a survey, we may request you to provide certain Personal Information i.e. any information that could be used to identify you (“Personal Information”).']"
7,0,0,0,0,0,0,0,0,0,0,0,0,0,0,0,0,0,0,0,0,0,1,0,0,0,0,0,0,0,0,0,0,0,0,0,0,0,0,0,0,M,2.865,['may'],['We may use a third-party service provider to conduct these surveys and this will be notified to you prior to the completion of the survey.(e)']
8,0,0,0,0,0,0,0,0,0,0,0,0,0,0,0,0,0,0,0,0,0,0,0,0,0,0,0,0,0,0,1,0,0,0,0,0,0,0,0,0,N,2.71,['certain'],"['You will disclose certain location information to us and to other Platform users when you access the Platform, as we derive location information from your IP address, device, or internet service for providing the Services or improving our platform such as to ensure that there are no multiple log-ins on your account.']"
9,0,0,0,0,0,0,0,0,1,0,0,0,0,0,0,0,0,0,0,0,0,2,0,0,0,0,0,0,0,0,0,0,0,0,0,0,0,0,0,0,CM,1.864,"['may', 'from time to time', 'may']","['· For security, fraud-detection and account management;\xa0· To be used for enhanced content targeting;\xa0· To provide you with location-based services that you choose to use:\xa0§\xa0 mini applications that may be made available on the Platform from time to time, which may require such information based on the services that they provide (if you choose to disclose your location to any mini application);§\xa0 ']"
10,0,0,0,0,0,0,0,0,1,0,0,0,0,0,0,0,0,0,0,0,0,1,0,0,0,0,0,0,0,0,0,0,0,0,0,0,0,0,0,0,CM,1.864,"['may', 'from time to time']",['Customer Support Information:\xa0Any information that you provide to our customer support team regarding any assistance or support that you may require for using our Platform from time to time.']
11,0,0,0,0,0,0,0,0,0,0,0,0,0,0,0,0,0,0,0,0,0,1,0,0,0,0,0,0,0,0,0,0,0,0,0,0,0,0,0,0,M,2.865,['may'],"['we may collect your Bluetooth signals, and information about nearby']"
12,0,0,0,0,0,0,0,0,0,0,0,0,0,0,0,0,0,0,0,0,0,1,0,0,0,0,0,0,0,0,0,0,0,0,0,0,0,0,0,0,M,2.865,['may'],"[""We may also use information from Apple's TrueDepth camera to improve the quality of lenses.""]"
13,0,0,0,0,0,0,0,0,0,0,0,0,0,0,0,0,0,0,0,0,0,0,0,0,0,0,0,0,0,0,0,1,0,0,0,0,0,0,0,0,N,2.71,['everyone'],"['·To be used for purposes of location feed;\xa0\xa0\xa0· To derive user language/personalisation;\xa0\xa0\xa0\xa0\xa0\xa0\xa0\xa0\xa0\xa0· To facilitate the sharing of any content on the Platform via the applications downloaded on your mobile device;\xa0\xa0\xa0\xa0\xa0\xa0\xa0\xa0\xa0\xa0· To improve the quality of camera lenses\xa0DISCLOSURE OF YOUR INFORMATION\xa0We disclose your information in the following manner:Content Visible to Others\xa0Public Content i.e., any content you post on your user profile or on another user’s profile, such as a post comment is accessible to everyone, including search engines.']"
14,0,0,0,0,0,0,0,0,0,0,0,0,0,0,0,0,0,0,0,0,0,0,0,0,0,0,0,0,0,1,0,0,0,0,0,0,0,0,0,0,N,2.71,['anyone'],"['Any information you voluntarily disclose for posting to the Platform, including your profile page information, is accessible to anyone.']"
15,0,0,0,0,0,0,0,0,0,0,0,0,0,0,0,0,0,0,0,0,0,1,0,0,0,0,0,0,0,0,0,0,0,0,0,0,0,0,0,0,M,2.865,['may'],"['When you submit, post or share the content that you choose to make public on the Platform, it may be re-shared by others.']"
16,0,0,0,0,0,0,0,0,0,0,0,0,0,0,0,0,0,0,0,0,0,0,0,2,0,0,0,0,0,0,0,0,0,0,0,0,0,0,0,0,M,2.865,"['can', 'can']","['You should consider who you choose to share it with, because people who can see your activity on our Platform can choose to share it with others on and off our Platform, including people outside the audience you shared it with.']"
17,0,0,0,0,0,0,0,0,0,0,0,0,0,0,0,0,0,0,0,0,0,0,0,1,0,0,0,0,0,0,0,0,0,0,0,0,0,0,0,0,M,2.865,['can'],"['Users can also use our Platform to create and share content about you with the audience that they choose, such as posting a photo of you or tagging you in any of their posts.']"
18,0,0,0,0,0,0,0,0,0,0,0,0,0,0,0,0,0,0,0,0,0,1,0,0,0,0,0,0,0,0,0,0,0,0,0,0,0,0,0,0,M,2.865,['may'],['Sharing with our Group of Companies\xa0We may share your Personal Information with any member of our Group.']
19,0,0,0,0,0,0,0,0,0,0,0,0,0,0,0,0,0,0,0,0,0,0,0,1,0,0,0,0,0,0,0,0,0,0,0,0,0,0,0,0,M,2.865,['can'],"['What you Share with Others\xa0When you share content and communicate using our Platform, you choose the audience who can view such content.']"
20,0,0,0,0,0,0,0,0,0,0,0,0,0,0,0,0,0,0,0,0,0,1,0,0,0,0,0,0,0,0,0,0,0,0,0,0,0,0,0,0,M,2.865,['may'],"['Sharing with Third Parties\xa0We may share your information (including Personal Information) with select third parties including:\xa0- Business partners, suppliers and subcontractors (“Affiliates”).']"
21,0,0,0,0,0,0,0,0,0,0,0,0,0,0,0,0,0,0,0,0,0,1,0,0,0,0,0,0,0,0,0,0,0,0,0,0,0,0,0,0,M,2.865,['may'],"['Affiliates may use this information to help provide, understand, and improve the Service and Affiliates’ own services for the performance of any contract that we enter into with you.\xa0']"
22,0,0,0,0,0,0,0,0,0,0,0,0,0,0,0,0,0,0,0,0,0,2,0,0,0,0,0,0,0,0,0,0,0,0,0,0,0,0,0,0,M,2.865,"['may', 'may']","['We do not disclose information about identifiable individuals to our advertisers, but we may provide them with aggregate information about our users (for example, we may inform them that any given number of women in a specified age group clicked on their advertisement on any given day).']"
23,0,0,0,0,0,0,0,0,0,0,0,0,0,0,0,0,0,0,0,0,0,1,0,0,0,0,0,0,0,0,0,0,0,0,0,0,0,0,0,0,M,2.865,['may'],['We may also use such aggregate information to help advertisers reach the kind of audience they want to target.\xa0']
24,0,1,0,0,0,0,0,0,0,0,0,0,0,0,0,0,0,0,0,0,0,0,0,0,0,0,0,0,0,0,0,0,0,0,0,0,0,0,0,0,C,1.783,['necessary'],"['- Government bodies or law enforcement agencies, if we have good-faith belief that it is reasonably necessary to share your personal data or information in order to comply with any legal obligation or any government request; or to protect the rights or prevent any harm to the property, or safety of the Company, our customers, or public; or to detect, prevent or otherwise address public safety, fraud, security or technical issues.']"
25,0,0,0,0,0,0,0,0,0,0,0,0,0,0,0,0,0,0,0,0,0,1,0,0,0,0,0,0,0,0,0,0,0,0,0,0,0,0,0,0,M,2.865,['may'],"['We may also disclose your information (including Personal Information) to select third parties in the following circumstances: \xa0\xa0- If the Company or substantially all of its assets are acquired by a third party, in which case personal data held by it about its customers will be one of the transferred assets.']"
26,0,0,0,0,0,0,0,0,0,0,0,0,0,0,0,0,0,0,0,0,0,0,0,1,0,1,0,0,0,0,0,0,0,0,0,0,0,0,0,0,M,2.865,"['would', 'can']","['If we are involved in a merger, acquisition, bankruptcy, reorganization, or sale of assets such that your information would be transferred or become subject to a different Privacy Policy, we will notify you in advance so you can opt out of any such new policy by deleting your account before transfer.\xa0\xa0']"
27,0,0,1,0,0,0,0,0,0,0,0,0,0,0,0,0,0,0,0,0,0,0,0,0,0,0,0,0,0,0,0,0,0,0,0,0,0,0,0,0,C,1.783,['appropriate'],['SECURITY PRACTICESWe have in place appropriate technical and security measures to secure the information collected by us.']
28,0,0,0,0,0,0,0,0,0,0,0,0,0,0,0,0,0,0,0,0,0,0,0,0,0,0,0,0,0,1,0,0,0,0,0,0,0,0,0,0,N,2.71,['anyone'],['We ask you not to share your password with anyone.']
29,0,0,0,0,0,0,0,0,0,0,0,0,0,0,0,0,0,0,0,0,0,1,0,0,0,0,0,0,0,0,0,0,0,0,0,0,0,0,0,0,M,2.865,['may'],['The Company may periodically update this Privacy Policy.']
30,0,0,0,0,0,0,0,0,0,0,0,0,0,0,0,0,0,0,0,0,0,1,0,0,0,0,0,0,0,0,0,0,0,0,0,0,0,0,0,0,M,2.865,['may'],"['DISCLAIMER\xa0Unfortunately, the transmission of information via the internet may not always be completely secure.']"
31,0,0,0,0,0,0,0,0,0,0,0,0,0,0,0,0,0,0,0,0,0,0,0,1,0,0,0,0,0,0,0,0,0,0,0,0,0,0,0,0,M,2.865,['can'],"['Although we will do our best to protect your Personal Information, we cannot guarantee the security of your data transmitted to the Platform; any transmission is at your own risk.']"
32,0,0,0,0,0,0,0,0,0,0,0,0,0,0,0,0,0,0,0,0,0,1,0,0,0,0,0,0,0,0,0,0,0,0,0,0,0,0,0,0,M,2.865,['may'],"['You may correct, amend, add or delete Personal Information from your account at any time by logging in and visiting your profile page.']"
33,0,0,0,0,0,0,0,0,0,0,0,0,0,0,0,0,0,0,0,0,0,1,0,0,0,0,0,0,0,0,0,0,0,0,0,0,0,0,0,0,M,2.865,['may'],"['As noted above, you may opt out from unwanted e-mail communications from us by following the instructions in the message.']"
34,0,0,0,0,0,0,0,0,0,0,0,0,0,0,0,0,0,0,0,0,0,1,0,0,0,0,0,0,0,0,0,0,0,0,0,0,0,0,0,0,M,2.865,['may'],['We do not retain your Sensitive Personal Information (defined below in this paragraph) for longer than is required for the purposes for which the information may be lawfully used.']
35,0,0,0,0,0,0,0,0,0,0,0,0,0,0,0,0,0,0,0,0,0,1,0,0,0,0,0,0,0,0,0,0,0,0,0,0,0,0,0,0,M,2.865,['may'],"['In addition, due to the nature of the internet, copies of your content, including content that you have removed or deleted from your account, may also exist elsewhere on the Internet and be retained indefinitely.']"
36,0,0,0,0,0,0,0,0,1,0,0,0,0,0,0,0,0,0,0,0,0,1,0,0,0,0,0,0,0,0,0,0,0,0,0,0,0,0,0,0,CM,1.864,"['may', 'from time to time']","['THIRD PARTY LINKS\xa0The Platform may, from time to time, contain links to and from the websites of our partner networks, advertisers, Affiliates and/or any other websites or mobile applications.']"
37,0,0,0,0,0,0,0,0,0,0,0,0,0,0,0,0,0,0,0,0,0,0,0,0,0,0,0,0,0,0,0,0,0,0,0,0,0,0,1,0,N,2.71,['various'],"['MUSIC LABELS\xa0By virtue of Moj being a short-video platform, we have entered into music license agreements with various music labels in order to ensure optimal user experience on the Platform.']"
38,0,0,0,0,0,0,0,0,1,0,0,0,0,0,0,0,0,0,0,0,0,0,1,0,0,0,0,0,0,0,0,0,0,0,0,0,0,0,0,0,CM,1.864,"['might', 'from time to time']",['Information pertaining to music data might be shared with such music labels from time to time in an anonymized manner.\xa0']
39,0,0,0,0,0,0,0,0,0,0,0,0,0,0,0,0,0,0,0,0,0,0,0,0,0,0,0,0,0,0,0,0,0,1,0,0,0,0,0,0,N,2.71,['some'],['Some of the content that you see displayed on the Platform is not hosted by the Platform.']
40,0,0,0,0,0,0,0,0,0,0,0,0,0,0,0,0,0,0,0,0,0,1,0,0,0,0,0,0,0,0,0,0,0,1,0,0,0,0,0,0,MN,2.569,"['some', 'may']","['Sharing Personal Information with Third Party Embeds\xa0Some embeds may ask you for Personal Information, such as your email address, through a form.']"
41,0,0,0,0,0,0,0,0,0,0,0,0,0,0,0,0,0,0,0,0,0,1,0,0,0,0,0,0,0,0,0,0,0,0,0,0,0,0,0,0,M,2.865,['may'],['Failure to do so may lead the Company to disable the post or take other action to limit or disable your account.\xa0']
42,0,1,0,0,0,0,0,0,1,0,0,0,0,0,0,0,0,0,0,0,0,1,0,0,0,0,0,0,0,0,0,0,0,0,0,0,0,0,0,0,CM,1.864,"['may', 'from time to time', 'necessary']","['may from time to time send you service-related announcements when we consider it necessary to do so (such as when we temporarily suspend the Platform for maintenance, or security, privacy, or administrative-related communications).']"
43,0,0,0,0,0,0,0,0,0,0,0,0,0,0,0,0,0,0,0,0,0,1,0,0,0,0,0,0,0,0,0,0,0,0,0,0,0,0,0,0,M,2.865,['may'],"['You may not opt-out of these service-related announcements, which are not promotional in nature and used solely to protect your account and keep you informed of important changes to the Platform.']"
44,0,0,0,0,0,0,0,0,0,0,0,0,0,0,0,0,0,0,0,0,0,1,0,0,0,0,0,0,0,0,0,0,0,0,0,0,0,0,0,0,M,2.865,['may'],"['You may contact Mr. Shagun Baldwa, Grievance Officer at any of the following:']"
